{
  "schema_version": "1.0",
  "source_revision": "2222222222222222222222222222222222222222",
  "scope": ["orders"],
  "readiness": [
    {
      "table_id": "orders",
      "source_path": "mappings/orders/readiness-status.yaml",
      "current_stage": "silver_ready",
      "stages": {
        "source_ready": {
          "status": "pass",
          "evidence": ["mappings/orders/source-profile.md"],
          "blocking_reasons": []
        },
        "mapping_ready": {
          "status": "pass",
          "evidence": ["mappings/orders/source-map.yaml"],
          "blocking_reasons": []
        }
      },
      "blocking_reasons": [],
      "next_action": "Author silver + gold migration SQL."
    }
  ],
  "artifacts": [],
  "approvals": [],
  "validation_boundary": {
    "static": "readiness statuses read from committed workspace files",
    "live": "unavailable",
    "unavailable_checks": ["live_database_validation", "powerbi_semantic_validation"]
  },
  "authority_disclaimer": "This is a test fixture passport; it grants no approval.",
  "passport_id": "passport-fixture-after",
  "generated_at": "2026-07-10T00:00:00+00:00"
}
